"product_map","Product"
"A70903","putative metalloprotease, Hemolysin-type calcium-binding region (rtxA)"
"A70921","RTX toxins and-related Ca2+-binding protein"
"A71019","bacteriocin biosynthesis cyclodehydratase SagC family"
"A71079","pore-forming bacteriocin colicin R"
"A71080","colicin R immunity protein"
"A7112","ShET2/EspL2 family type III secretion system effector toxin"
"A71131","bacteriocin formation protein"
"A71247","botulinum neurotoxin type H"
"A71253","Shiga toxin Stx2h subunit B"
"A71254","Shiga toxin Stx2h subunit A"
"A71342","colicin V precursor"
"A71372","pyrogenic exotoxin C precursor, phage associated, putative"
"A71437","antitoxin HicB family"
"A71477","toxin higb- component of a toxin-antitoxin loci"
"A7280","colicin V"
"A7281","colicin V immunity protein"
"A7282","colicin-B"
"A7283","colicin B immunity protein"
"A7284","lipid II-degrading bacteriocin colicin M"
"A7285","colicin M immunity protein"
"A7293","type II toxin-antitoxin system antitoxin PemI"
"A7301","toxin-antitoxin system antitoxin VapB"
"A7333","type I toxin-antitoxin system Hok family toxin"
"A7474","type I toxin-antitoxin system toxin HokD"
"A7477","toxin YdaT family protein"
"A7597","colicin E1 family microcin immunity protein"
"A7599","enterotoxin production-related protein TieB"
"A7618","serine protease autotransporter toxin SigA"
"A7623","type II toxin-antitoxin system PrlF family antitoxin"
"A7632","damage-inducible type I toxin DinQ"
"A7641","toxin co-regulated pilus biosynthesis Q family protein"
"A7647","DinQ-like type I toxin DqlB"
"A7835","SymE family type I addiction module toxin"
"A7836","toxin-antitoxin system HicB family antitoxin"
"A7949","YjhX family toxin"
"A8129","toxin YdaT domain-containing protein"
"A8138","hemolysin XhlA"
"A8215","polymorphic toxin type 44 domain-containing protein"
"A8300","toxic anion resistance protein"
"A8336","enterotoxin"
"A8431","EmmdR/YeeO family multidrug/toxin efflux MATE transporter"
"A8438","type II toxin-antitoxin system death-on-curing family toxin"
"A8592","VapC toxin family PIN domain ribonuclease"
"A8649","type II toxin-antitoxin system antitoxin RelB"
"A8655","MbcA/ParS/Xre antitoxin family protein"
"A8692","type II toxin-antitoxin system toxin CcdB"
"A8693","type II toxin-antitoxin system antitoxin CcdA"
"A8750","pyocin knob domain-containing protein"
"A8823","type II toxin-antitoxin system YafQ family toxin"
"A8853","putative holin-like toxin"
"A9009","type II toxin-antitoxin system YoeB family toxin"
"A9186","bacteriocin family protein"
"A9413","putative thiazole-containing bacteriocin maturation protein"
"A9434","T7SS effector LXG polymorphic toxin"
"A947","hemolysin family protein"
"A9506","type II toxin-antitoxin system endoribonuclease NdoA"
"A9602","lactococcin 972 family bacteriocin"
"A9713","pre-toxin TG domain-containing protein"
"A9714","HNH/endonuclease VII fold putative polymorphic toxin"
"A9983","hemolysin XhlA family protein"
